smartctl 6.5 2016-05-07 r4318 [x86_64-linux-4.10.11-1-ARCH] (local build)
Copyright (C) 2002-16, Bruce Allen, Christian Franke, www.smartmontools.org

=== START OF INFORMATION SECTION ===
Model Family:     Seagate Barracuda ES.2
Device Model:     ST31000340NS
Add. Product Id:  DELL(tm)
Firmware Version: MA0D
User Capacity:    1.000.204.886.016 bytes [1,00 TB]
Sector Size:      512 bytes logical/physical
Rotation Rate:    7200 rpm
Device is:        In smartctl database [for details use: -P show]
ATA Version is:   ATA8-ACS T13/1699-D revision 4
SATA Version is:  SATA 2.6, 3.0 Gb/s
Local Time is:    Wed May 10 14:39:08 2017 CEST
SMART support is: Available - device has SMART capability.
SMART support is: Enabled

=== START OF READ SMART DATA SECTION ===
SMART overall-health self-assessment test result: FAILED!
Drive failure expected in less than 24 hours. SAVE ALL DATA.
See vendor-specific Attribute list for failed Attributes.

General SMART Values:
Offline data collection status:  (0x82)	Offline data collection activity
					was completed without error.
					Auto Offline Data Collection: Enabled.
Self-test execution status:      (   0)	The previous self-test routine completed
					without error or no self-test has ever 
					been run.
Total time to complete Offline 
data collection: 		(  625) seconds.
Offline data collection
capabilities: 			 (0x7b) SMART execute Offline immediate.
					Auto Offline data collection on/off support.
					Suspend Offline collection upon new
					command.
					Offline surface scan supported.
					Self-test supported.
					Conveyance Self-test supported.
					Selective Self-test supported.
SMART capabilities:            (0x0003)	Saves SMART data before entering
					power-saving mode.
					Supports SMART auto save timer.
Error logging capability:        (0x01)	Error logging supported.
					General Purpose Logging supported.
Short self-test routine 
recommended polling time: 	 (   1) minutes.
Extended self-test routine
recommended polling time: 	 ( 228) minutes.
Conveyance self-test routine
recommended polling time: 	 (   2) minutes.
SCT capabilities: 	       (0x103d)	SCT Status supported.
					SCT Error Recovery Control supported.
					SCT Feature Control supported.
					SCT Data Table supported.

SMART Attributes Data Structure revision number: 10
Vendor Specific SMART Attributes with Thresholds:
ID# ATTRIBUTE_NAME          FLAG     VALUE WORST THRESH TYPE      UPDATED  WHEN_FAILED RAW_VALUE
  1 Raw_Read_Error_Rate     0x000f   049   049   044    Pre-fail  Always       -       28158525
  3 Spin_Up_Time            0x0003   099   098   000    Pre-fail  Always       -       0
  4 Start_Stop_Count        0x0032   100   100   020    Old_age   Always       -       45
  5 Reallocated_Sector_Ct   0x0033   032   032   036    Pre-fail  Always   FAILING_NOW 1399
  7 Seek_Error_Rate         0x000f   081   060   030    Pre-fail  Always       -       4419028142
  9 Power_On_Hours          0x0032   067   067   000    Old_age   Always       -       29356
 10 Spin_Retry_Count        0x0013   100   100   097    Pre-fail  Always       -       0
 12 Power_Cycle_Count       0x0032   100   037   020    Old_age   Always       -       45
184 End-to-End_Error        0x0032   100   100   099    Old_age   Always       -       0
187 Reported_Uncorrect      0x0032   001   001   000    Old_age   Always       -       393
188 Command_Timeout         0x0032   096   096   000    Old_age   Always       -       17180131334
189 High_Fly_Writes         0x003a   100   100   000    Old_age   Always       -       0
190 Airflow_Temperature_Cel 0x0022   079   059   045    Old_age   Always       -       21 (Min/Max 20/21)
194 Temperature_Celsius     0x0022   021   041   000    Old_age   Always       -       21 (0 20 0 0 0)
195 Hardware_ECC_Recovered  0x001a   023   019   000    Old_age   Always       -       28158525
197 Current_Pending_Sector  0x0012   100   100   000    Old_age   Always       -       227
198 Offline_Uncorrectable   0x0010   100   100   000    Old_age   Offline      -       227
199 UDMA_CRC_Error_Count    0x003e   200   200   000    Old_age   Always       -       0

SMART Error Log Version: 1
ATA Error Count: 9 (device log contains only the most recent five errors)
	CR = Command Register [HEX]
	FR = Features Register [HEX]
	SC = Sector Count Register [HEX]
	SN = Sector Number Register [HEX]
	CL = Cylinder Low Register [HEX]
	CH = Cylinder High Register [HEX]
	DH = Device/Head Register [HEX]
	DC = Device Command Register [HEX]
	ER = Error register [HEX]
	ST = Status register [HEX]
Powered_Up_Time is measured from power on, and printed as
DDd+hh:mm:SS.sss where DD=days, hh=hours, mm=minutes,
SS=sec, and sss=millisec. It "wraps" after 49.710 days.

Error 9 occurred at disk power-on lifetime: 29243 hours (1218 days + 11 hours)
  When the command that caused the error occurred, the device was active or idle.

  After command completion occurred, registers were:
  ER ST SC SN CL CH DH
  -- -- -- -- -- -- --
  40 51 00 00 a7 22 00  Error: UNC at LBA = 0x0022a700 = 2270976

  Commands leading to the command that caused the error were:
  CR FR SC SN CL CH DH DC   Powered_Up_Time  Command/Feature_Name
  -- -- -- -- -- -- -- --  ----------------  --------------------
  60 00 80 00 a7 22 40 00   5d+17:50:39.259  READ FPDMA QUEUED
  61 00 80 80 ab 22 40 00   5d+17:50:39.259  WRITE FPDMA QUEUED
  61 00 80 ff ff ff 4f 00   5d+17:50:39.258  WRITE FPDMA QUEUED
  61 00 80 ff ff ff 4f 00   5d+17:50:39.257  WRITE FPDMA QUEUED
  61 00 80 80 9d 1d 40 00   5d+17:50:39.257  WRITE FPDMA QUEUED

Error 8 occurred at disk power-on lifetime: 29243 hours (1218 days + 11 hours)
  When the command that caused the error occurred, the device was active or idle.

  After command completion occurred, registers were:
  ER ST SC SN CL CH DH
  -- -- -- -- -- -- --
  40 51 00 00 a7 22 00  Error: WP at LBA = 0x0022a700 = 2270976

  Commands leading to the command that caused the error were:
  CR FR SC SN CL CH DH DC   Powered_Up_Time  Command/Feature_Name
  -- -- -- -- -- -- -- --  ----------------  --------------------
  61 00 08 ff ff ff 4f 00   5d+17:50:25.986  WRITE FPDMA QUEUED
  61 00 80 ff ff ff 4f 00   5d+17:50:25.984  WRITE FPDMA QUEUED
  61 00 08 ff ff ff 4f 00   5d+17:50:25.983  WRITE FPDMA QUEUED
  61 00 10 ff ff ff 4f 00   5d+17:50:25.982  WRITE FPDMA QUEUED
  61 00 10 ff ff ff 4f 00   5d+17:50:25.981  WRITE FPDMA QUEUED

Error 7 occurred at disk power-on lifetime: 29157 hours (1214 days + 21 hours)
  When the command that caused the error occurred, the device was active or idle.

  After command completion occurred, registers were:
  ER ST SC SN CL CH DH
  -- -- -- -- -- -- --
  40 51 00 59 75 3e 06  Error: UNC at LBA = 0x063e7559 = 104756569

  Commands leading to the command that caused the error were:
  CR FR SC SN CL CH DH DC   Powered_Up_Time  Command/Feature_Name
  -- -- -- -- -- -- -- --  ----------------  --------------------
  60 00 5e 22 75 3e 46 00   2d+03:40:43.873  READ FPDMA QUEUED
  60 00 22 00 75 3e 46 00   2d+03:40:43.872  READ FPDMA QUEUED
  60 00 5e a2 74 3e 46 00   2d+03:40:43.848  READ FPDMA QUEUED
  60 00 22 80 74 3e 46 00   2d+03:40:43.846  READ FPDMA QUEUED
  60 00 5e 22 74 3e 46 00   2d+03:40:43.826  READ FPDMA QUEUED

Error 6 occurred at disk power-on lifetime: 29156 hours (1214 days + 20 hours)
  When the command that caused the error occurred, the device was active or idle.

  After command completion occurred, registers were:
  ER ST SC SN CL CH DH
  -- -- -- -- -- -- --
  40 51 00 85 68 3d 06  Error: UNC at LBA = 0x063d6885 = 104687749

  Commands leading to the command that caused the error were:
  CR FR SC SN CL CH DH DC   Powered_Up_Time  Command/Feature_Name
  -- -- -- -- -- -- -- --  ----------------  --------------------
  60 00 5e a2 64 3d 46 00   2d+03:01:50.520  READ FPDMA QUEUED
  60 00 22 80 64 3d 46 00   2d+03:01:50.518  READ FPDMA QUEUED
  60 00 5e a2 62 3d 46 00   2d+03:01:49.729  READ FPDMA QUEUED
  60 00 22 80 62 3d 46 00   2d+03:01:49.721  READ FPDMA QUEUED
  60 00 5e 22 d9 8a 46 00   2d+03:01:49.355  READ FPDMA QUEUED

Error 5 occurred at disk power-on lifetime: 29131 hours (1213 days + 19 hours)
  When the command that caused the error occurred, the device was active or idle.

  After command completion occurred, registers were:
  ER ST SC SN CL CH DH
  -- -- -- -- -- -- --
  40 51 00 50 0a 3d 06  Error: UNC at LBA = 0x063d0a50 = 104663632

  Commands leading to the command that caused the error were:
  CR FR SC SN CL CH DH DC   Powered_Up_Time  Command/Feature_Name
  -- -- -- -- -- -- -- --  ----------------  --------------------
  60 00 5e 22 0a 3d 46 00   1d+02:21:20.020  READ FPDMA QUEUED
  60 00 2e 22 0a 3d 46 00   1d+02:21:19.871  READ FPDMA QUEUED
  2f 00 01 10 00 00 00 00   1d+02:21:19.812  READ LOG EXT
  60 00 46 ba 04 3d 46 00   1d+02:21:12.899  READ FPDMA QUEUED
  60 00 32 80 04 3d 46 00   1d+02:21:12.898  READ FPDMA QUEUED

SMART Self-test log structure revision number 1
Num  Test_Description    Status                  Remaining  LifeTime(hours)  LBA_of_first_error
# 1  Extended offline    Completed without error       00%        11         -
# 2  Short offline       Completed without error       00%         7         -
# 3  Extended offline    Completed without error       00%         3         -
# 4  Short offline       Completed without error       00%         0         -

SMART Selective self-test log data structure revision number 1
 SPAN  MIN_LBA  MAX_LBA  CURRENT_TEST_STATUS
    1        0        0  Not_testing
    2        0        0  Not_testing
    3        0        0  Not_testing
    4        0        0  Not_testing
    5        0        0  Not_testing
Selective self-test flags (0x0):
  After scanning selected spans, do NOT read-scan remainder of disk.
If Selective self-test is pending on power-up, resume after 0 minute delay.

