smartctl 6.5 2016-05-07 r4318 [x86_64-linux-4.10.11-1-ARCH] (local build)
Copyright (C) 2002-16, Bruce Allen, Christian Franke, www.smartmontools.org

=== START OF INFORMATION SECTION ===
Model Family:     SAMSUNG SpinPoint F3
Device Model:     SAMSUNG HD103SJ
Firmware Version: 1AJ10002
User Capacity:    1.000.204.886.016 bytes [1,00 TB]
Sector Size:      512 bytes logical/physical
Rotation Rate:    7200 rpm
Form Factor:      3.5 inches
Device is:        In smartctl database [for details use: -P show]
ATA Version is:   ATA8-ACS T13/1699-D revision 6
SATA Version is:  SATA 2.6, 3.0 Gb/s
Local Time is:    Tue May 16 15:11:05 2017 CEST
SMART support is: Available - device has SMART capability.
SMART support is: Enabled

=== START OF READ SMART DATA SECTION ===
SMART overall-health self-assessment test result: FAILED!
Drive failure expected in less than 24 hours. SAVE ALL DATA.
See vendor-specific Attribute list for failed Attributes.

General SMART Values:
Offline data collection status:  (0x82)	Offline data collection activity
					was completed without error.
					Auto Offline Data Collection: Enabled.
Self-test execution status:      ( 137)	The previous self-test completed having
					a test element that failed and the
					device is suspected of having handling
					damage.
Total time to complete Offline 
data collection: 		( 9300) seconds.
Offline data collection
capabilities: 			 (0x5b) SMART execute Offline immediate.
					Auto Offline data collection on/off support.
					Suspend Offline collection upon new
					command.
					Offline surface scan supported.
					Self-test supported.
					No Conveyance Self-test supported.
					Selective Self-test supported.
SMART capabilities:            (0x0003)	Saves SMART data before entering
					power-saving mode.
					Supports SMART auto save timer.
Error logging capability:        (0x01)	Error logging supported.
					General Purpose Logging supported.
Short self-test routine 
recommended polling time: 	 (   2) minutes.
Extended self-test routine
recommended polling time: 	 ( 155) minutes.
SCT capabilities: 	       (0x003f)	SCT Status supported.
					SCT Error Recovery Control supported.
					SCT Feature Control supported.
					SCT Data Table supported.

SMART Attributes Data Structure revision number: 16
Vendor Specific SMART Attributes with Thresholds:
ID# ATTRIBUTE_NAME          FLAG     VALUE WORST THRESH TYPE      UPDATED  WHEN_FAILED RAW_VALUE
  1 Raw_Read_Error_Rate     0x002f   100   100   051    Pre-fail  Always       -       0
  2 Throughput_Performance  0x0027   252   252   000    Pre-fail  Always       -       0
  3 Spin_Up_Time            0x0023   070   070   025    Pre-fail  Always       -       9135
  4 Start_Stop_Count        0x0032   099   099   000    Old_age   Always       -       1929
  5 Reallocated_Sector_Ct   0x0033   252   252   010    Pre-fail  Always       -       0
  7 Seek_Error_Rate         0x002f   252   252   051    Pre-fail  Always       -       0
  8 Seek_Time_Performance   0x0025   252   252   015    Pre-fail  Offline      -       0
  9 Power_On_Hours          0x0032   100   100   000    Old_age   Always       -       9877
 10 Spin_Retry_Count        0x0033   252   252   051    Pre-fail  Always       -       0
 11 Calibration_Retry_Count 0x0032   252   252   000    Old_age   Always       -       0
 12 Power_Cycle_Count       0x0032   099   099   000    Old_age   Always       -       1938
183 Runtime_Bad_Block       0x0032   100   100   010    Old_age   Always       -       19
184 End-to-End_Error        0x0033   095   095   097    Pre-fail  Always   FAILING_NOW 6
186 Unknown_Attribute       0x0032   252   252   000    Old_age   Always       -       0
187 Reported_Uncorrect      0x0032   252   252   000    Old_age   Always       -       0
188 Command_Timeout         0x0032   252   252   000    Old_age   Always       -       0
190 Airflow_Temperature_Cel 0x0002   076   061   040    Old_age   Always       -       24 (Min/Max 18/39)
191 G-Sense_Error_Rate      0x0022   252   252   000    Old_age   Always       -       0
192 Power-Off_Retract_Count 0x0022   252   252   000    Old_age   Always       -       0
193 Load_Cycle_Count        0x0032   100   100   000    Old_age   Always       -       1938
194 Temperature_Celsius     0x0002   064   061   000    Old_age   Always       -       24 (Min/Max 18/39)
195 Hardware_ECC_Recovered  0x003a   100   100   000    Old_age   Always       -       0
196 Reallocated_Event_Count 0x0032   252   252   000    Old_age   Always       -       0
197 Current_Pending_Sector  0x0032   252   252   000    Old_age   Always       -       0
198 Offline_Uncorrectable   0x0030   252   252   000    Old_age   Offline      -       0
199 UDMA_CRC_Error_Count    0x0036   100   100   000    Old_age   Always       -       16
200 Multi_Zone_Error_Rate   0x002a   100   100   000    Old_age   Always       -       133

SMART Error Log Version: 1
No Errors Logged

SMART Self-test log structure revision number 1
Num  Test_Description    Status                  Remaining  LifeTime(hours)  LBA_of_first_error
# 1  Extended offline    Completed: handling damage??  90%      9862         0

SMART Selective self-test log data structure revision number 0
Note: revision number not 1 implies that no selective self-test has ever been run
 SPAN  MIN_LBA  MAX_LBA  CURRENT_TEST_STATUS
    1        0        0  Completed_handling_damage?? [90% left] (0-65535)
    2        0        0  Not_testing
    3        0        0  Not_testing
    4        0        0  Not_testing
    5        0        0  Not_testing
Selective self-test flags (0x0):
  After scanning selected spans, do NOT read-scan remainder of disk.
If Selective self-test is pending on power-up, resume after 0 minute delay.

