smartctl 6.5 2016-05-07 r4318 [x86_64-linux-4.10.11-1-ARCH] (local build)
Copyright (C) 2002-16, Bruce Allen, Christian Franke, www.smartmontools.org

=== START OF INFORMATION SECTION ===
Model Family:     Seagate Barracuda ES.2
Device Model:     ST31000340NS
Add. Product Id:  DELL(tm)
Firmware Version: MA10
User Capacity:    1.000.204.886.016 bytes [1,00 TB]
Sector Size:      512 bytes logical/physical
Rotation Rate:    7200 rpm
Device is:        In smartctl database [for details use: -P show]
ATA Version is:   ATA8-ACS T13/1699-D revision 4
SATA Version is:  SATA 2.6, 3.0 Gb/s
Local Time is:    Wed May 10 13:29:56 2017 CEST
SMART support is: Available - device has SMART capability.
SMART support is: Enabled

=== START OF READ SMART DATA SECTION ===
SMART overall-health self-assessment test result: PASSED

General SMART Values:
Offline data collection status:  (0x82)	Offline data collection activity
					was completed without error.
					Auto Offline Data Collection: Enabled.
Self-test execution status:      (   0)	The previous self-test routine completed
					without error or no self-test has ever 
					been run.
Total time to complete Offline 
data collection: 		(  634) seconds.
Offline data collection
capabilities: 			 (0x7b) SMART execute Offline immediate.
					Auto Offline data collection on/off support.
					Suspend Offline collection upon new
					command.
					Offline surface scan supported.
					Self-test supported.
					Conveyance Self-test supported.
					Selective Self-test supported.
SMART capabilities:            (0x0003)	Saves SMART data before entering
					power-saving mode.
					Supports SMART auto save timer.
Error logging capability:        (0x01)	Error logging supported.
					General Purpose Logging supported.
Short self-test routine 
recommended polling time: 	 (   2) minutes.
Extended self-test routine
recommended polling time: 	 ( 234) minutes.
Conveyance self-test routine
recommended polling time: 	 (   3) minutes.
SCT capabilities: 	       (0x103d)	SCT Status supported.
					SCT Error Recovery Control supported.
					SCT Feature Control supported.
					SCT Data Table supported.

SMART Attributes Data Structure revision number: 10
Vendor Specific SMART Attributes with Thresholds:
ID# ATTRIBUTE_NAME          FLAG     VALUE WORST THRESH TYPE      UPDATED  WHEN_FAILED RAW_VALUE
  1 Raw_Read_Error_Rate     0x000f   083   063   044    Pre-fail  Always       -       223034311
  3 Spin_Up_Time            0x0003   099   098   000    Pre-fail  Always       -       0
  4 Start_Stop_Count        0x0032   100   100   020    Old_age   Always       -       82
  5 Reallocated_Sector_Ct   0x0033   100   100   036    Pre-fail  Always       -       14
  7 Seek_Error_Rate         0x000f   084   060   030    Pre-fail  Always       -       244979309
  9 Power_On_Hours          0x0032   026   026   000    Old_age   Always       -       65113
 10 Spin_Retry_Count        0x0013   100   100   097    Pre-fail  Always       -       0
 12 Power_Cycle_Count       0x0032   100   037   020    Old_age   Always       -       82
184 End-to-End_Error        0x0032   100   100   099    Old_age   Always       -       0
187 Reported_Uncorrect      0x0032   097   097   000    Old_age   Always       -       3
188 Command_Timeout         0x0032   100   100   000    Old_age   Always       -       0
189 High_Fly_Writes         0x003a   100   100   000    Old_age   Always       -       0
190 Airflow_Temperature_Cel 0x0022   079   059   045    Old_age   Always       -       21 (Min/Max 20/21)
194 Temperature_Celsius     0x0022   021   041   000    Old_age   Always       -       21 (0 19 0 0 0)
195 Hardware_ECC_Recovered  0x001a   035   019   000    Old_age   Always       -       223034311
197 Current_Pending_Sector  0x0012   100   100   000    Old_age   Always       -       0
198 Offline_Uncorrectable   0x0010   100   100   000    Old_age   Offline      -       0
199 UDMA_CRC_Error_Count    0x003e   200   200   000    Old_age   Always       -       0

SMART Error Log Version: 1
ATA Error Count: 3
	CR = Command Register [HEX]
	FR = Features Register [HEX]
	SC = Sector Count Register [HEX]
	SN = Sector Number Register [HEX]
	CL = Cylinder Low Register [HEX]
	CH = Cylinder High Register [HEX]
	DH = Device/Head Register [HEX]
	DC = Device Command Register [HEX]
	ER = Error register [HEX]
	ST = Status register [HEX]
Powered_Up_Time is measured from power on, and printed as
DDd+hh:mm:SS.sss where DD=days, hh=hours, mm=minutes,
SS=sec, and sss=millisec. It "wraps" after 49.710 days.

Error 3 occurred at disk power-on lifetime: 63209 hours (2633 days + 17 hours)
  When the command that caused the error occurred, the device was active or idle.

  After command completion occurred, registers were:
  ER ST SC SN CL CH DH
  -- -- -- -- -- -- --
  40 51 00 84 82 00 01  Error: UNC at LBA = 0x01008284 = 16810628

  Commands leading to the command that caused the error were:
  CR FR SC SN CL CH DH DC   Powered_Up_Time  Command/Feature_Name
  -- -- -- -- -- -- -- --  ----------------  --------------------
  42 00 00 00 80 00 41 00   3d+00:14:49.206  READ VERIFY SECTOR(S) EXT
  42 00 00 00 70 00 41 00   3d+00:14:49.152  READ VERIFY SECTOR(S) EXT
  42 00 00 00 60 f3 40 00   3d+00:14:45.074  READ VERIFY SECTOR(S) EXT
  42 00 00 00 70 e3 40 00   3d+00:14:40.235  READ VERIFY SECTOR(S) EXT
  42 00 00 00 80 d3 40 00   3d+00:14:35.151  READ VERIFY SECTOR(S) EXT

Error 2 occurred at disk power-on lifetime: 4097 hours (170 days + 17 hours)
  When the command that caused the error occurred, the device was active or idle.

  After command completion occurred, registers were:
  ER ST SC SN CL CH DH
  -- -- -- -- -- -- --
  40 51 00 ff ff ff 0f  Error: UNC at LBA = 0x0fffffff = 268435455

  Commands leading to the command that caused the error were:
  CR FR SC SN CL CH DH DC   Powered_Up_Time  Command/Feature_Name
  -- -- -- -- -- -- -- --  ----------------  --------------------
  42 00 00 ff ff ff 4f 00  31d+05:59:38.405  READ VERIFY SECTOR(S) EXT
  42 00 01 ff ff ff 4f 00  31d+05:59:38.254  READ VERIFY SECTOR(S) EXT
  35 00 01 ff ff ff 4f 00  31d+05:59:38.253  WRITE DMA EXT
  60 00 1e ff ff ff 4f 00  31d+05:59:38.096  READ FPDMA QUEUED
  60 00 62 ff ff ff 4f 00  31d+05:59:38.096  READ FPDMA QUEUED

Error 1 occurred at disk power-on lifetime: 4097 hours (170 days + 17 hours)
  When the command that caused the error occurred, the device was active or idle.

  After command completion occurred, registers were:
  ER ST SC SN CL CH DH
  -- -- -- -- -- -- --
  40 51 00 ff ff ff 0f  Error: UNC at LBA = 0x0fffffff = 268435455

  Commands leading to the command that caused the error were:
  CR FR SC SN CL CH DH DC   Powered_Up_Time  Command/Feature_Name
  -- -- -- -- -- -- -- --  ----------------  --------------------
  42 00 00 ff ff ff 4f 00  31d+05:59:35.058  READ VERIFY SECTOR(S) EXT
  42 00 00 ff ff ff 4f 00  31d+05:59:34.766  READ VERIFY SECTOR(S) EXT
  42 00 00 ff ff ff 4f 00  31d+05:59:34.728  READ VERIFY SECTOR(S) EXT
  60 00 1e ff ff ff 4f 00  31d+05:59:27.652  READ FPDMA QUEUED
  60 00 62 ff ff ff 4f 00  31d+05:59:27.641  READ FPDMA QUEUED

SMART Self-test log structure revision number 1
Num  Test_Description    Status                  Remaining  LifeTime(hours)  LBA_of_first_error
# 1  Short offline       Completed without error       00%     47057         -
# 2  Extended offline    Completed without error       00%        31         -
# 3  Short offline       Completed without error       00%        27         -
# 4  Extended offline    Completed without error       00%        23         -
# 5  Short offline       Completed without error       00%        20         -

SMART Selective self-test log data structure revision number 1
 SPAN  MIN_LBA  MAX_LBA  CURRENT_TEST_STATUS
    1        0        0  Not_testing
    2        0        0  Not_testing
    3        0        0  Not_testing
    4        0        0  Not_testing
    5        0        0  Not_testing
Selective self-test flags (0x0):
  After scanning selected spans, do NOT read-scan remainder of disk.
If Selective self-test is pending on power-up, resume after 0 minute delay.

