smartctl 6.5 2016-05-07 r4318 [x86_64-linux-4.10.11-1-ARCH] (local build)
Copyright (C) 2002-16, Bruce Allen, Christian Franke, www.smartmontools.org

=== START OF INFORMATION SECTION ===
Model Family:     Seagate Barracuda ES.2
Device Model:     ST31000340NS
Firmware Version: SN06
User Capacity:    1.000.204.886.016 bytes [1,00 TB]
Sector Size:      512 bytes logical/physical
Rotation Rate:    7200 rpm
Device is:        In smartctl database [for details use: -P show]
ATA Version is:   ATA8-ACS T13/1699-D revision 4
SATA Version is:  SATA 2.6, 3.0 Gb/s
Local Time is:    Tue May 16 15:13:34 2017 CEST
SMART support is: Available - device has SMART capability.
SMART support is: Enabled

=== START OF READ SMART DATA SECTION ===
SMART overall-health self-assessment test result: PASSED

General SMART Values:
Offline data collection status:  (0x82)	Offline data collection activity
					was completed without error.
					Auto Offline Data Collection: Enabled.
Self-test execution status:      (   0)	The previous self-test routine completed
					without error or no self-test has ever 
					been run.
Total time to complete Offline 
data collection: 		(  650) seconds.
Offline data collection
capabilities: 			 (0x7b) SMART execute Offline immediate.
					Auto Offline data collection on/off support.
					Suspend Offline collection upon new
					command.
					Offline surface scan supported.
					Self-test supported.
					Conveyance Self-test supported.
					Selective Self-test supported.
SMART capabilities:            (0x0003)	Saves SMART data before entering
					power-saving mode.
					Supports SMART auto save timer.
Error logging capability:        (0x01)	Error logging supported.
					General Purpose Logging supported.
Short self-test routine 
recommended polling time: 	 (   1) minutes.
Extended self-test routine
recommended polling time: 	 ( 234) minutes.
Conveyance self-test routine
recommended polling time: 	 (   2) minutes.
SCT capabilities: 	       (0x103d)	SCT Status supported.
					SCT Error Recovery Control supported.
					SCT Feature Control supported.
					SCT Data Table supported.

SMART Attributes Data Structure revision number: 10
Vendor Specific SMART Attributes with Thresholds:
ID# ATTRIBUTE_NAME          FLAG     VALUE WORST THRESH TYPE      UPDATED  WHEN_FAILED RAW_VALUE
  1 Raw_Read_Error_Rate     0x000f   062   062   044    Pre-fail  Always       -       35072262
  3 Spin_Up_Time            0x0003   099   098   000    Pre-fail  Always       -       0
  4 Start_Stop_Count        0x0032   100   100   020    Old_age   Always       -       51
  5 Reallocated_Sector_Ct   0x0033   100   100   036    Pre-fail  Always       -       1
  7 Seek_Error_Rate         0x000f   060   051   030    Pre-fail  Always       -       481188578098
  9 Power_On_Hours          0x0032   055   055   000    Old_age   Always       -       39644
 10 Spin_Retry_Count        0x0013   100   100   097    Pre-fail  Always       -       0
 12 Power_Cycle_Count       0x0032   100   037   020    Old_age   Always       -       51
184 End-to-End_Error        0x0032   100   100   099    Old_age   Always       -       0
187 Reported_Uncorrect      0x0032   090   090   000    Old_age   Always       -       10
188 Command_Timeout         0x0032   100   099   000    Old_age   Always       -       1
189 High_Fly_Writes         0x003a   094   094   000    Old_age   Always       -       6
190 Airflow_Temperature_Cel 0x0022   076   053   045    Old_age   Always       -       24 (Min/Max 23/24)
194 Temperature_Celsius     0x0022   024   047   000    Old_age   Always       -       24 (0 13 0 0 0)
195 Hardware_ECC_Recovered  0x001a   026   008   000    Old_age   Always       -       35072262
197 Current_Pending_Sector  0x0012   100   100   000    Old_age   Always       -       0
198 Offline_Uncorrectable   0x0010   100   100   000    Old_age   Offline      -       0
199 UDMA_CRC_Error_Count    0x003e   200   200   000    Old_age   Always       -       0

SMART Error Log Version: 1
ATA Error Count: 8 (device log contains only the most recent five errors)
	CR = Command Register [HEX]
	FR = Features Register [HEX]
	SC = Sector Count Register [HEX]
	SN = Sector Number Register [HEX]
	CL = Cylinder Low Register [HEX]
	CH = Cylinder High Register [HEX]
	DH = Device/Head Register [HEX]
	DC = Device Command Register [HEX]
	ER = Error register [HEX]
	ST = Status register [HEX]
Powered_Up_Time is measured from power on, and printed as
DDd+hh:mm:SS.sss where DD=days, hh=hours, mm=minutes,
SS=sec, and sss=millisec. It "wraps" after 49.710 days.

Error 8 occurred at disk power-on lifetime: 39624 hours (1651 days + 0 hours)
  When the command that caused the error occurred, the device was active or idle.

  After command completion occurred, registers were:
  ER ST SC SN CL CH DH
  -- -- -- -- -- -- --
  40 51 00 f9 e1 3d 09  Error: UNC at LBA = 0x093de1f9 = 155050489

  Commands leading to the command that caused the error were:
  CR FR SC SN CL CH DH DC   Powered_Up_Time  Command/Feature_Name
  -- -- -- -- -- -- -- --  ----------------  --------------------
  c8 00 d8 d8 e1 3d e9 00      00:43:07.711  READ DMA
  c8 00 c0 b0 08 0b e9 00      00:43:07.702  READ DMA
  c8 00 c8 98 d6 3d e9 00      00:43:07.689  READ DMA
  c8 00 90 f8 2e 18 e9 00      00:43:07.686  READ DMA
  c8 00 10 20 2c 18 e9 00      00:43:07.668  READ DMA

Error 7 occurred at disk power-on lifetime: 39624 hours (1651 days + 0 hours)
  When the command that caused the error occurred, the device was active or idle.

  After command completion occurred, registers were:
  ER ST SC SN CL CH DH
  -- -- -- -- -- -- --
  40 51 00 79 71 6e 09  Error: UNC at LBA = 0x096e7179 = 158232953

  Commands leading to the command that caused the error were:
  CR FR SC SN CL CH DH DC   Powered_Up_Time  Command/Feature_Name
  -- -- -- -- -- -- -- --  ----------------  --------------------
  c8 00 08 78 71 6e e9 00      00:27:45.872  READ DMA
  c8 00 08 68 71 55 e9 00      00:27:45.861  READ DMA
  c8 00 08 e0 fa 6b e9 00      00:27:45.836  READ DMA
  c8 00 10 28 e5 24 e9 00      00:27:45.812  READ DMA
  c8 00 10 78 d1 15 e9 00      00:27:45.796  READ DMA

Error 6 occurred at disk power-on lifetime: 39624 hours (1651 days + 0 hours)
  When the command that caused the error occurred, the device was active or idle.

  After command completion occurred, registers were:
  ER ST SC SN CL CH DH
  -- -- -- -- -- -- --
  40 51 00 fb b6 25 09  Error: UNC at LBA = 0x0925b6fb = 153466619

  Commands leading to the command that caused the error were:
  CR FR SC SN CL CH DH DC   Powered_Up_Time  Command/Feature_Name
  -- -- -- -- -- -- -- --  ----------------  --------------------
  c8 00 10 f8 b6 25 e9 00      00:04:42.191  READ DMA
  c8 00 08 08 69 98 e9 00      00:04:42.185  READ DMA
  c8 00 08 a8 b5 58 e9 00      00:04:42.156  READ DMA
  c8 00 10 a0 e3 20 e9 00      00:04:42.131  READ DMA
  c8 00 08 d8 96 58 e9 00      00:04:42.126  READ DMA

Error 5 occurred at disk power-on lifetime: 39154 hours (1631 days + 10 hours)
  When the command that caused the error occurred, the device was active or idle.

  After command completion occurred, registers were:
  ER ST SC SN CL CH DH
  -- -- -- -- -- -- --
  40 51 00 44 c1 18 07  Error: UNC at LBA = 0x0718c144 = 119062852

  Commands leading to the command that caused the error were:
  CR FR SC SN CL CH DH DC   Powered_Up_Time  Command/Feature_Name
  -- -- -- -- -- -- -- --  ----------------  --------------------
  c8 00 10 40 c1 18 e7 00  10d+16:57:34.754  READ DMA
  c8 00 08 a8 bf 17 e7 00  10d+16:57:34.752  READ DMA
  c8 00 08 58 bf 17 e7 00  10d+16:57:34.742  READ DMA
  c8 00 08 40 41 17 e7 00  10d+16:57:34.740  READ DMA
  c8 00 10 c0 3f 17 e7 00  10d+16:57:34.730  READ DMA

Error 4 occurred at disk power-on lifetime: 38483 hours (1603 days + 11 hours)
  When the command that caused the error occurred, the device was active or idle.

  After command completion occurred, registers were:
  ER ST SC SN CL CH DH
  -- -- -- -- -- -- --
  40 51 00 79 d2 d5 00  Error: UNC at LBA = 0x00d5d279 = 14013049

  Commands leading to the command that caused the error were:
  CR FR SC SN CL CH DH DC   Powered_Up_Time  Command/Feature_Name
  -- -- -- -- -- -- -- --  ----------------  --------------------
  c8 00 00 50 d2 d5 e0 00  32d+10:48:35.701  READ DMA
  c8 00 e0 70 d1 d5 e0 00  32d+10:48:35.700  READ DMA
  c8 00 e0 90 d0 d5 e0 00  32d+10:48:35.699  READ DMA
  c8 00 a0 f0 cf d5 e0 00  32d+10:48:35.698  READ DMA
  c8 00 c0 78 54 b1 e0 00  32d+10:48:35.697  READ DMA

SMART Self-test log structure revision number 1
Num  Test_Description    Status                  Remaining  LifeTime(hours)  LBA_of_first_error
# 1  Extended offline    Completed without error       00%     39632         -
# 2  Short offline       Completed without error       00%     37484         -

SMART Selective self-test log data structure revision number 1
 SPAN  MIN_LBA  MAX_LBA  CURRENT_TEST_STATUS
    1        0        0  Not_testing
    2        0        0  Not_testing
    3        0        0  Not_testing
    4        0        0  Not_testing
    5        0        0  Not_testing
Selective self-test flags (0x0):
  After scanning selected spans, do NOT read-scan remainder of disk.
If Selective self-test is pending on power-up, resume after 0 minute delay.

